{
  "fixtureId": "FIX-003-DHIRAAGU",
  "description": "Dhiraagu / Ooredoo Commercial Fiber Broadband Internet Tax Invoice",
  "sourceDocument": {
    "fileName": "dhiraagu_internet_tax_invoice_2026_06.pdf",
    "supplierName": "Dhiraagu PLC",
    "supplierTin": "1000001GST001",
    "invoiceNumber": "DH-2026-993810",
    "issueDate": "2026-06-25",
    "currency": "MVR"
  },
  "expectedExtraction": {
    "subtotal": 3200.00,
    "gstAmount": 256.00,
    "totalAmount": 3456.00,
    "gstRate": 8
  },
  "expectedAssertions": {
    "documentType": "TELECOM_INVOICE",
    "accountingCategory": "telecommunications",
    "subcategory": "internet_data",
    "gstTreatment": "STANDARD_RATED_8",
    "miraCategory": "other_expenses",
    "incomeTaxTreatment": "DEDUCTIBLE",
    "reviewRequired": false,
    "adjustmentCode": "NONE"
  }
}
